1.,Beef Noodles,Noodles cooked with beautiful sexy beef.,Vegan:No Gluten:No,$5.00,
2.,Chicken Burger,Grilled chicken with lettuce and ketchup that will make the ladies want you.,Vegan:No Gluten:Yes,$5.00,
3.,Fruit Salad,Fruit Salad with Orange Pineapple Kiwi Melon and apple pen,Vegan:Yes Gluten:Yes,$5.00,
4.,Eggs Benedict,Pouched egg with bacon muffin and hollandaise sauce with a springkle of love,Vegan: No Gluten:Yes,$5.00,
5.,Egg Fried Rice,Rice Egg and MSG just how Uncle Roger likes,Vegan:No Gluten:No,$5.00,
6.,French Toast Wee Wee,Just toast and diabetes Wee Wee,Vegan:YES Gluten:Yes,$5.00,
